{
  "$schema": "../../_meta/relationships.schema.json",
  "module": "12-postgres",
  "version": 1,
  "updated_at": "2026-08-04",
  "terms": {
    "client_server_model": {
      "level": 1,
      "file": "terms/level_01/client_server_model.md",
      "display_name": "Client-Server Model (in Databases)",
      "prerequisites": [
        {
          "term": "postgresql",
          "module": "12-postgres",
          "description": "The database server process."
        }
      ],
      "related": [
        {
          "term": "postgresql",
          "module": "12-postgres",
          "description": "The server engine."
        },
        {
          "term": "connection_string",
          "module": "12-postgres",
          "description": "The client connection guide."
        },
        {
          "term": "psql",
          "module": "12-postgres",
          "description": "Related concept: `psql` (Interactive Terminal)."
        },
        {
          "module": "12-postgres",
          "term": "connection_pooling",
          "description": "Related concept: Connection Pooling."
        }
      ]
    },
    "column": {
      "level": 1,
      "file": "terms/level_01/column.md",
      "display_name": "Column (Field / Attribute)",
      "prerequisites": [
        {
          "term": "table",
          "module": "12-postgres",
          "description": "The parent container grid where columns are defined."
        }
      ],
      "related": [
        {
          "term": "table",
          "module": "12-postgres",
          "description": "The parent container."
        },
        {
          "term": "row",
          "module": "12-postgres",
          "description": "The horizontal record unit."
        },
        {
          "term": "relational_database",
          "module": "12-postgres",
          "description": "Related concept: Relational Database."
        }
      ]
    },
    "connection_string": {
      "level": 1,
      "file": "terms/level_01/connection_string.md",
      "display_name": "Connection String / DSN",
      "prerequisites": [
        {
          "term": "client_server_model",
          "module": "12-postgres",
          "description": "Understanding that client libraries require parameters to find database servers."
        }
      ],
      "related": [
        {
          "term": "client_server_model",
          "module": "12-postgres",
          "description": "The network structure."
        },
        {
          "term": "psql",
          "module": "12-postgres",
          "description": "Connects using connection strings."
        },
        {
          "term": "pgadmin",
          "module": "12-postgres",
          "description": "Related concept: pgAdmin & GUI Tools."
        }
      ]
    },
    "create_drop_database": {
      "level": 1,
      "file": "terms/level_01/create_drop_database.md",
      "display_name": "`CREATE DATABASE` / `DROP DATABASE`",
      "prerequisites": [
        {
          "term": "postgresql",
          "module": "12-postgres",
          "description": "The host server where databases are created."
        },
        {
          "term": "sql",
          "module": "12-postgres",
          "description": "The language schema query syntax."
        }
      ],
      "related": [
        {
          "term": "database",
          "module": "12-postgres",
          "description": "The target logical container."
        },
        {
          "term": "create_drop_table",
          "module": "12-postgres",
          "description": "Managing structures inside the database."
        }
      ]
    },
    "create_drop_table": {
      "level": 1,
      "file": "terms/level_01/create_drop_table.md",
      "display_name": "`CREATE TABLE` / `DROP TABLE`",
      "prerequisites": [
        {
          "term": "table",
          "module": "12-postgres",
          "description": "The logical data grid being managed."
        },
        {
          "term": "sql",
          "module": "12-postgres",
          "description": "The declarative syntax standard."
        }
      ],
      "related": [
        {
          "term": "table",
          "module": "12-postgres",
          "description": "The resulting storage structure."
        },
        {
          "term": "create_drop_database",
          "module": "12-postgres",
          "description": "Managing the parent database containers."
        },
        {
          "term": "sql",
          "module": "12-postgres",
          "description": "Related concept: SQL (Structured Query Language)."
        },
        {
          "term": "truncate",
          "module": "12-postgres",
          "description": "Related concept: `TRUNCATE`."
        },
        {
          "term": "alter_table",
          "module": "12-postgres",
          "description": "Related concept: `ALTER TABLE`."
        }
      ]
    },
    "database": {
      "level": 1,
      "file": "terms/level_01/database.md",
      "display_name": "Database",
      "prerequisites": [],
      "related": [
        {
          "term": "postgresql",
          "module": "12-postgres",
          "description": "A specific type of database management system."
        },
        {
          "term": "relational_database",
          "module": "12-postgres",
          "description": "The relational structural philosophy."
        },
        {
          "term": "create_drop_database",
          "module": "12-postgres",
          "description": "Related concept: `CREATE DATABASE` / `DROP DATABASE`."
        },
        {
          "term": "schema",
          "module": "12-postgres",
          "description": "Related concept: Schema."
        },
        {
          "term": "sql",
          "module": "12-postgres",
          "description": "Related concept: SQL (Structured Query Language)."
        }
      ]
    },
    "pgadmin": {
      "level": 1,
      "file": "terms/level_01/pgadmin.md",
      "display_name": "pgAdmin & GUI Tools",
      "prerequisites": [
        {
          "term": "client_server_model",
          "module": "12-postgres",
          "description": "Understanding that visual tools are clients connecting to a background server."
        }
      ],
      "related": [
        {
          "term": "psql",
          "module": "12-postgres",
          "description": "The command-line alternative."
        },
        {
          "term": "connection_string",
          "module": "12-postgres",
          "description": "The parameters used by GUIs to connect."
        }
      ]
    },
    "postgresql": {
      "level": 1,
      "file": "terms/level_01/postgresql.md",
      "display_name": "PostgreSQL (Postgres)",
      "prerequisites": [
        {
          "term": "database",
          "module": "12-postgres",
          "description": "Understanding why we need database storage."
        }
      ],
      "related": [
        {
          "term": "database",
          "module": "12-postgres",
          "description": "The parent technology class."
        },
        {
          "term": "relational_database",
          "module": "12-postgres",
          "description": "The relational data structure model."
        },
        {
          "term": "client_server_model",
          "module": "12-postgres",
          "description": "Related concept: Client-Server Model (in Databases)."
        },
        {
          "module": "12-postgres",
          "term": "psql",
          "description": "Interactive terminal CLI."
        }
      ]
    },
    "psql": {
      "level": 1,
      "file": "terms/level_01/psql.md",
      "display_name": "`psql` (Interactive Terminal)",
      "prerequisites": [
        {
          "term": "client_server_model",
          "module": "12-postgres",
          "description": "Understanding that `psql` is a client connecting to a server process."
        }
      ],
      "related": [
        {
          "term": "client_server_model",
          "module": "12-postgres",
          "description": "The underlying network architecture."
        },
        {
          "term": "pgadmin",
          "module": "12-postgres",
          "description": "The graphical client alternative."
        },
        {
          "term": "connection_string",
          "module": "12-postgres",
          "description": "Related concept: Connection String / DSN."
        },
        {
          "module": "12-postgres",
          "term": "postgresql",
          "description": "Related concept: PostgreSQL (Postgres)."
        }
      ]
    },
    "relational_database": {
      "level": 1,
      "file": "terms/level_01/relational_database.md",
      "display_name": "Relational Database",
      "prerequisites": [
        {
          "term": "database",
          "module": "12-postgres",
          "description": "Why databases exist in software architecture."
        }
      ],
      "related": [
        {
          "term": "table",
          "module": "12-postgres",
          "description": "The core storage grid."
        },
        {
          "term": "row",
          "module": "12-postgres",
          "description": "The horizontal database entry."
        },
        {
          "term": "column",
          "module": "12-postgres",
          "description": "The vertical data category."
        },
        {
          "term": "database",
          "module": "12-postgres",
          "description": "Related concept: Database."
        },
        {
          "term": "postgresql",
          "module": "12-postgres",
          "description": "Related concept: PostgreSQL (Postgres)."
        },
        {
          "module": "12-postgres",
          "term": "sql",
          "description": "SQL query language."
        }
      ]
    },
    "row": {
      "level": 1,
      "file": "terms/level_01/row.md",
      "display_name": "Row (Record / Tuple)",
      "prerequisites": [
        {
          "term": "table",
          "module": "12-postgres",
          "description": "The parent container grid where rows live."